{
  "schema_version": "1.0.0",
  "manifest_id": "security-runtime-default",
  "schema_registry": {
    "registry_id": "urn:gew:schema-registry:security-foundation:1.0.0",
    "registry_digest": "sha256-jcs-v1:5af3f2ba14d440f50e6194d9ea1aa9bc510e6573a0f19e7a8d564fdf9f0fd9b4"
  },
  "allowed_runtime_kinds": [
    "codex",
    "hermes"
  ],
  "policies": {
    "action": {
      "policy_id": "action-policy-default",
      "policy_digest": "sha256-jcs-v1:6ee5df645f42eca7aee1fe855b35b4d074d1ccc34aad369489cf1e71115d1178"
    },
    "disclosure": {
      "policy_id": "disclosure-default",
      "policy_digest": "sha256-jcs-v1:f0cf26b04185e961157a147979f3c6608e2d8ba0fc6947318b97a6711186b28e"
    },
    "evidence": {
      "policy_id": "evidence-default",
      "policy_digest": "sha256-jcs-v1:93c46845fb22c01b3b109cd9ad716abbc6f05ca1fbe3490bbd2264caaa7fd6b3"
    },
    "input-safety": {
      "policy_id": "input-safety-default",
      "policy_digest": "sha256-jcs-v1:7290c7fed6193fc7e4ab166fa81cf8309c33c9d0278461c0b23acf31c91d31cc"
    },
    "redaction": {
      "policy_id": "redaction-default",
      "policy_digest": "sha256-jcs-v1:65868c76b5118ce0a4609097770ac893842c429eaba159e889ec7c50b4931aa8"
    },
    "retention": {
      "policy_id": "retention-default",
      "policy_digest": "sha256-jcs-v1:36625b80fd867613618482a45701de2cb65ca2a245b6c616e0fe32b9ff5b458c"
    }
  },
  "manifest_digest": "sha256-jcs-v1:ab0fb578b27d03ef6f2ce4ab88c0f37e86a936c4442880845d5bcb627a07a171"
}
